{
  "$schema": "../schemas/capability-map.schema.json",
  "policyId": "capability-map.v1",
  "version": 2,
  "status": "draft-but-authoritative",
  "purpose": "Map abstract capability slugs (the strings briefModel emits in siteBrief.requestedCapabilities) to the Dossiers that can satisfy them. planningModel reads this in Sprint 2B to know which Dossiers are even candidates before running embedding + rerank. v2 (2026-06-08): mount-only honesty for section_add capabilities — mounting does not promise visible preview render.",
  "principles": [
    "A capability slug is the contract; the Dossier is the implementation. New capabilities require either a Dossier under packages/generation/orchestration/dossiers/{soft,hard}/ or an explicit empty-list comment so codegen knows to surface the gap.",
    "Empty dossiers list is allowed - it means the capability is recognised but no implementation exists yet. The comment field documents the plan.",
    "default must be one of dossiers when set. It is the planningModel fallback when no other signal differentiates the candidates.",
    "Dossier IDs match folder names under packages/generation/orchestration/dossiers/{soft,hard}/. The dossier's manifest.json declares its class and capability.",
    "Empty capability = gap, not feature. planningModel MUST NOT include a capability with an empty dossiers list in the implemented selectedDossiers of a Site Plan. It MAY surface the gap to the operator (e.g. via a notesForPlanner entry on the Site Brief) so the project either drops the capability, picks a different one or waits for the planned Dossier to be imported.",
    "section_add follow-up (section_builder role) is mount-only today: mounting a capability + Dossier into the next version (requestedCapabilities + selectedDossiers.required) does NOT promise visible preview render or appliedVisibleEffect=true. An existing render_section_* helper is necessary but not sufficient; visible surfacing is a separate render-path concern (see packages/generation/followup/section_directives.py)."
  ],
  "capabilities": {
    "interactive-game": {
      "dossiers": ["interactive-game-loop"],
      "default": "interactive-game-loop",
      "comment": "Pacman-style soft Dossier; verified mounted by tests/test_dossier_mounting.py."
    },
    "contact-form": {
      "dossiers": ["mailto-contact-form"],
      "default": "mailto-contact-form",
      "comment": "mailto-contact-form is the safe default (soft, zero env). Mount-only via section_add today; render_section_contact_cta exists but visible preview surfacing is not guaranteed until the dedicated render-path lands. resend-contact-form (hard) planned for server-side delivery."
    },
    "menu": {
      "dossiers": ["menu-display"],
      "default": "menu-display",
      "comment": "menu-display is a soft instructions-only Dossier for restaurant/café menus grouped by course with per-item price and dietary markers. No external API; menu data is supplied via project-input or starter content."
    },
    "booking": {
      "dossiers": ["booking-cta"],
      "default": "booking-cta",
      "comment": "booking-cta is a soft instructions-only Dossier rendering a phone/external/mailto CTA with adjacent hours. Hard alternatives (caspeco-api, bokadirekt-api, calendly-embed) are planned imports for sites needing real availability."
    },
    "gallery": {
      "dossiers": ["image-gallery"],
      "default": "image-gallery",
      "comment": "image-gallery is a soft instructions-only Dossier (CSS-grid gallery). Mount-only via section_add today; render_section_gallery exists but visible preview surfacing is not guaranteed until the dedicated render-path lands."
    },
    "hours": {
      "dossiers": ["opening-hours"],
      "default": "opening-hours",
      "comment": "opening-hours is a soft instructions-only Dossier (weekday hours + OpeningHours JSON-LD). Mount-only via section_add today; render_section_hours_summary exists but visible preview surfacing is not guaranteed until the dedicated render-path lands."
    },
    "reviews": {
      "dossiers": ["reviews-display"],
      "default": "reviews-display",
      "comment": "reviews-display is a soft instructions-only Dossier (card grid + Review JSON-LD; static project-input content). Mount-only via section_add today: render_section_reviews-testimonials exists but visible preview surfacing is not guaranteed until the dedicated render-path lands. Hard alternatives (google-places-reviews, trustpilot-widget) planned for live pulls."
    },
    "location": {
      "dossiers": ["map-embed"],
      "default": "map-embed",
      "comment": "map-embed is a soft instructions-only Dossier (OSM iframe + address block). Mount-only via section_add today; render_map exists but visible preview surfacing is not guaranteed until the dedicated render-path lands."
    },
    "pricing": {
      "dossiers": ["pricing-table"],
      "default": "pricing-table",
      "comment": "pricing-table is a soft instructions-only Dossier (tier cards + CTAs). Mount-only via section_add today; render_pricing exists but visible preview surfacing is not guaranteed until the dedicated render-path lands."
    },
    "hero-video": {
      "dossiers": ["video-hero"],
      "default": "video-hero",
      "comment": "video-hero is a soft instructions-only Dossier rendering an autoplay-muted-loop background video using the native <video> element with poster fallback, preload=metadata, prefers-reduced-motion handling and a foreground text overlay. NO YouTube/Vimeo embed (those ship 600KB trackers). Hard alternatives (mux-player-react, vimeo-player) are planned imports for sites needing adaptive bitrate or playback analytics."
    },
    "newsletter-subscribe": {
      "dossiers": [],
      "comment": "No Dossier in repo yet. MIN_IDE has mailchimp-newsletter (hard) as the planned import."
    },
    "payments": {
      "dossiers": [],
      "comment": "No Dossier in repo yet. MIN_IDE has stripe-checkout (hard) as the planned import."
    },
    "auth": {
      "dossiers": [],
      "comment": "No Dossier in repo yet. MIN_IDE has clerk-auth (hard) as the planned import; supabase-auth is a future alternative."
    },
    "analytics": {
      "dossiers": [],
      "comment": "No Dossier in repo yet. MIN_IDE has plausible-analytics and vercel-analytics (both hard) as planned imports."
    },
    "ai-chat": {
      "dossiers": [],
      "comment": "No Dossier in repo yet. MIN_IDE has openai-chat (hard) as the planned import."
    },
    "error-tracking": {
      "dossiers": [],
      "comment": "No Dossier in repo yet. MIN_IDE has sentry-error-tracking (hard) as the planned import."
    },
    "faq-section": {
      "dossiers": ["faq-accordion"],
      "default": "faq-accordion",
      "comment": "faq-accordion is a soft instructions-only Dossier (native <details>/<summary> + FAQPage JSON-LD). Mount-only via section_add today: capability mounts into next version; render_section_faq exists but visible preview surfacing is not guaranteed until the dedicated render-path lands."
    },
    "carousel": {
      "dossiers": [],
      "comment": "No Dossier in repo yet. MIN_IDE has embla-carousel (soft) as the planned import."
    },
    "marquee": {
      "dossiers": [],
      "comment": "No Dossier in repo yet. MIN_IDE has marquee-scroller (soft) as the planned import."
    },
    "command-search": {
      "dossiers": [],
      "comment": "No Dossier in repo yet. MIN_IDE has cmdk-command-palette (soft) as the planned import."
    },
    "team-section": {
      "dossiers": ["team-roster"],
      "default": "team-roster",
      "comment": "team-roster is a soft instructions-only Dossier (monogram cards from company.team). Mount-only via section_add today: mounts through requestedCapabilities + selectedDossiers.required; render_section_team exists but appliedVisibleEffect may stay false until visible render-path work lands."
    },
    "guarantees": {
      "dossiers": ["trust-guarantees"],
      "default": "trust-guarantees",
      "comment": "trust-guarantees is a soft instructions-only Dossier ('Varfor oss' icon bullets grounded in trustSignals/USPs/businessFacts). Mount-only via section_add today: render_section_trust_proof exists but visible preview surfacing is not guaranteed until the dedicated render-path lands."
    }
  }
}
